{
  "$schema": "../readiness/evidence.schema.json",
  "approved_by": null,
  "environment": "ci",
  "evidence_reference": "Generated by scripts/backend_certification_check.py from local backend source gates.",
  "evidence_type": "backend-certification-check",
  "expires_at": "2026-09-29T23:17:47.430172+00:00",
  "gate": "BACKEND_CERTIFICATION",
  "generated_at": "2026-08-30T23:17:47.430172+00:00",
  "metadata": {
    "checks": [
      {
        "detail": "exit=0; All checks passed!",
        "name": "backend.static_analysis",
        "status": "PASS"
      },
      {
        "detail": "exit=0",
        "name": "backend.compileall",
        "status": "PASS"
      },
      {
        "detail": "exit=0; {\"deployment_permitted\": false, \"release_status\": \"UNVERIFIED\", \"runtime_status\": \"UNVERIFIED\", \"target_host\": \"49.12.145.107\"}",
        "name": "backend.release_locks.fail_closed_shape",
        "status": "PASS"
      },
      {
        "detail": "checksum=aec53253dbca5ce6feb3c01b4bac12770f801de51621209558640b3957ae3031; backend_dirty=False; source=git_blob",
        "name": "backend.release_configuration_checksum.git_blob",
        "status": "PASS"
      },
      {
        "detail": "exit=0; OpenAPI contract verified: 142 paths, 22 reviewed additions",
        "name": "backend.openapi_contract",
        "status": "PASS"
      },
      {
        "detail": "exit=0; 131 passed, 4 skipped, 1 warning in 24.83s",
        "name": "backend.pytest",
        "status": "PASS"
      },
      {
        "detail": "exit=0; SMOKE_SUMMARY pass=56 skip=4 fail=0",
        "name": "backend.smoke_api",
        "status": "PASS"
      },
      {
        "detail": "deployment remains blocked; pass=24 blocked=40 fail=0",
        "name": "backend.production_launch_gate.fail_closed",
        "status": "PASS"
      },
      {
        "detail": "not run locally; release image workflow must publish and scan immutable digests",
        "name": "backend.container_validation",
        "status": "BLOCKED"
      }
    ],
    "deployment_permitted": false,
    "scope": "MoneyBee backend only"
  },
  "source_sha": "f6c71a65c70db13bd63ab7ad166d00cadb9b3b0a",
  "status": "PARTIAL"
}
